Match Index,Query Index,Game,Base Sentence,Similarity Score
386,386,GIRIS CUMLESI,powerups general every piece control even applicable opponents pieces,1.0
3417,386,ankeocunghuy_Game-project-LockedOut,adding amount eerieness would lack hands body player control solely relying skill judgement,0.9865922927856445
4868,386,BurntToaster-Pirate15_Project-Prometheus,shard sunspark protected alchemy venture collect sunsparks restore sun ... primary mechanics turn cycle player makes action npcs make action player armed potion gun bunch different options depending unlocked far shadow small moveset tell advance i.e,0.9799015522003174
37709,386,Redback-Operations_redback-documentation,example close competition players camera could zoom headtohead sprints critical overtaking moments,0.9785767197608948
23468,386,kingpinzs_neuro-fusion-labs,actively playing players engage memory logic puzzlebased activities speed mining process move,0.9784547686576843
24816,386,LangzeL_Night-of-Amnesia,outcome utilizing corridors looping mechanism player successfully approaches doctor behind uses scalpel attack,0.9779205322265625
