Match Index,Query Index,Game,Base Sentence,Similarity Score
386,386,GIRIS CUMLESI,powerups general every piece control even applicable opponents pieces,1.0
388,386,A01752391_Videojuego,powerups affect board exchange pieces disappear pieces etc,0.4738447588060698
30479,386,nadeem-shahzad_TheLastPieceStanding,pieces player controls king rotating cast fallen hero pieces,0.407439833554342
37278,386,Ragnaroknfthive_Ragnarok-Card-,fewer pieces,0.38608036784978744
30496,386,nadeem-shahzad_TheLastPieceStanding,4. enemy pieces enemy pieces varying movement speeds attack capabilities,0.38209065930483277
397,386,A01752391_Videojuego,time piece selected clicked upon squares piece move lighted,0.3433409207501505
