Match Index,Query Index,Game,Base Sentence,Similarity Score
386,386,GIRIS CUMLESI,powerups general every piece control even applicable opponents pieces,1.0
41015,386,Seraphendipity_WaS,regarding interaction two favor side numbers something said reactable easily conquered ai minions longterm planning preparation execution defeated simple reactions another player hence combat general risky costly unreactable readbased offense,0.9708625078201294
20862,386,Jamie-McCaw_Hackathon2023,malware general malware ransomware enemies steal encrypt data exploit exploits type malware takes advantage bugs vulnerabilities system order allow exploits creator take control,0.9635125398635864
3469,386,ankeocunghuy_Game-project-LockedOut,server room noise would dominated repeated slam resumes rejected emphasising clerks power control,0.9580572843551636
9026,386,DevKoenv_foundations-of-fantasy,reproduction population control npcs form families reproduce pass traits skills even memories offspring,0.9567394256591797
38656,386,rooch-network_rooch,roochfish caught fish opensource fullchain game based rooch blockchain players buy control virtual fish multiple dynamic fish ponds,0.9567122459411621
